{"available_actions":["approve","reject","block_with_comment"],"display":{"action_label":"Create issue","guardrail_type":"sensitive_tool","message":"Approve creating a Jira issue?","node_name":"sensitive_tool_guard","tool_args_json":"{\"project\":\"OPS\",\"summary\":\"Disk full\"}","tool_call_id":"call_jira_1","tool_name":"create_issue","toolkit_name":"jira","toolkit_type":"jira"},"fanout_v1":{"activation":"9f2c4e1a7b3d5f60","kind":"parallel","member":"jira_branch","node":"research","ordinal":1,"total":3},"interrupt_id":"hitl:sensitive:0001","interrupt_key":"93ba421dbbbcc4f07e5b3366f081d1ef3ac983c422a3b9e48ed1fbe05b2d6a87","kind":"tool_guard","parent_agent_call_id":"fo1_fd47d5a520dc10ff429e8c38e13656305daf31781c78c477db942ad604db4031","parent_agent_name":"Researcher","parent_agent_path":[{"call_id":"fo1_fd47d5a520dc10ff429e8c38e13656305daf31781c78c477db942ad604db4031","name":"Researcher","sibling_ordinal":1}],"payload_sha256":"187c94b83c2e41baadf2b343172080a6a152294c3c6eaebb7e639b1b8f5e76c4","schema":"elitea.pipeline.fanout-interrupt-card.v1"}