{"available_actions":["approve","reject","block_with_comment"],"display":{"action_label":"Customer Support.search_records","guardrail_type":"sensitive_tool","message":"Example Corp requires approval before running the sensitive action 'Customer Support.search_records'.","node_name":"lookup","policy_message":"Example Corp requires approval before running the sensitive action 'Customer Support.search_records'.","tool_args_json":"{\"filters\":{\"active\":true},\"query\":\"ticket 9\"}","tool_call_id":"pipeline:lookup:1","tool_name":"search_records","toolkit_name":"Customer Support","toolkit_type":"customer_support"},"fanout_v1":{"activation":"0123456789abcdef","kind":"parallel","member":"left","node":"fan","ordinal":1,"total":2},"interrupt_id":"hitl_gt1:Dguvde_dwnCNiEscTN433rJsN2u9LnU09CpjwzUjsqI","interrupt_key":"aaaaaaaaaaaaaaaaaaaaaaaaaaaaaaaaaaaaaaaaaaaaaaaaaaaaaaaaaaaaaaaa","kind":"tool_guard","parent_agent_call_id":"fo1_fac7121054a6ef04719b369f74c4cd6093dba908c40855f9f6b6c994ddd23030","parent_agent_name":"worker","parent_agent_path":[{"call_id":"fo1_fac7121054a6ef04719b369f74c4cd6093dba908c40855f9f6b6c994ddd23030","name":"worker","sibling_ordinal":1}],"payload_sha256":"532a1f3db0f44327d37ade7673924276d59807173a769456f35611327c8b6ac1","schema":"elitea.pipeline.fanout-interrupt-card.v1"}
